101,00007323,旧三井寺ポンプ所及び変電所,きゅうみいでらぽんぷじょおよびへんでんしょ,1棟,,登録有形文化財(建造物),産業1次,建築物,,昭和前,昭和8,1933,煉瓦造平屋建、瓦葺、建築面積223㎡,,40 － 0060,60,2008.07.23(平成20.07.23),2008.07.08(平成20.07.08),,20080708,,国土の歴史的景観に寄与しているもの,,福岡県,福岡県久留米市三潴町高三潴字三井寺1101-7,,筑後川土地改良区,,,33.25907000000000,130.45860000000000,寄棟造の東棟と切妻造の南棟がＬ字型に続き、南棟の北に一段低い寄棟造の北棟が付く。イギリス積の煉瓦造平屋建で、屋根は桟瓦葺。面積２２３㎡。東棟と南棟には半円アーチ窓を開ける。小屋はキングポスト・トラス。田園風景の中に残る、もと農業用水施設である。,https://bunka.nii.ac.jp/heritage/43967/_108305/43967_108305111225030618996_300.jpg
101,00008597,石蔵酒造事務所兼主屋,いしくらしゅぞうじむしょけんしゅおく,1棟,,登録有形文化財(建造物),産業2次,建築物,,大正,大正期,1912-1926,木造2階建、瓦葺、建築面積204㎡、煙突付,,40 － 0061,69,2011.01.26(平成23.01.26),2011.01.26(平成23.01.26),,20110126,,国土の歴史的景観に寄与しているもの,,福岡県,福岡県福岡市博多区堅粕1-3-6,,石蔵酒造株式会社,,,33.59871000000000,130.41750000000000,通りの北側に位置する。間口一八メートルの二階建町家で、桁行に西から土間、事務室、居室の三部分に分かれ、屋根も入母屋と切妻の複雑な構成となる。一階に平格子、二階に漆喰仕上げの大壁に銅板貼の両開戸を設けるなど、意匠性豊かな表構えをつくる。,https://bunka.nii.ac.jp/heritage/43967/_134993/43967_134993269855868334326_300.jpg
101,00008598,石蔵酒造主倉,いしくらしゅぞうしゅぐら,1棟,,登録有形文化財(建造物),産業2次,建築物,,明治,明治中期,1883-1897,木造2階建、瓦葺、建築面積974㎡,,40 － 0062,69,2011.01.26(平成23.01.26),2011.01.26(平成23.01.26),,20110126,,国土の歴史的景観に寄与しているもの,,福岡県,福岡県福岡市博多区堅粕1-3-6,,,,,33.59886000000000,130.41760000000000,事務所兼主屋の北に位置する。東西棟の切妻造桟瓦葺で、南・北面全面に下屋を付設。桁行三九メートル、梁間は併せて二六メートルに及ぶ。妻面は下見板張とし、鉢巻などを漆喰で仕上げる。二階建で、トラス組が豊かな内部空間をつくる。大規模な酒造倉の一例。,https://bunka.nii.ac.jp/heritage/43967/_134994/43967_134994111225034532173_300.jpg
101,00008599,石蔵酒造西倉及び旧精米所,いしくらしゅぞうにしくらおよびきゅうせいまいじょ,1棟,,登録有形文化財(建造物),産業2次,建築物,,昭和前,昭和前期,1926-1945,木造2階建、瓦葺、建築面積429㎡、渡廊下、煙突及び釜場付,,40 － 0063,69,2011.01.26(平成23.01.26),2011.01.26(平成23.01.26),,20110126,,国土の歴史的景観に寄与しているもの,,福岡県,福岡県福岡市博多区堅粕1-3-6,,,,,33.59908000000000,130.41740000000000,敷地の西隅に位置する。通り沿いの旧精米所とその北の西倉からなり、事務所への渡り廊下を付設する。いずれも切妻造桟瓦葺で、西面妻は下見板張、南面は腰高に下見板を張り、上部漆喰仕上げ。下見板の黒色と漆喰の白の鮮やかな対比が趣ある外観をつくる。,https://bunka.nii.ac.jp/heritage/43967/_134995/43967_134995111225034533730_300.jpg
101,00008600,髙橋家住宅店舗兼主屋,たかはしけじゅうたくてんぽけんしゅおく,1棟,,登録有形文化財(建造物),産業3次,建築物,,大正,大正前期,1912-1918,木造2階建、瓦葺、建築面積70㎡,,40 － 0064,69,2011.01.26(平成23.01.26),2011.01.26(平成23.01.26),,20110126,,造形の規範となっているもの,,福岡県,福岡県福岡市博多区下呉服町72,,,,,33.60221000000000,130.40780000000000,博多町人町に位置し、竪町筋に北面する。間口五・六メートル奥行一二メートルの木造二階建。切妻造桟瓦葺で正面に庇を付ける。二階は格子戸、一階はガラス戸を全面にたてる。通り土間で正面にミセを設け、二階に座敷三室を配する。標準的な博多の近代町家。,https://bunka.nii.ac.jp/heritage/43967/_134996/43967_134996266066191096459_300.jpg
101,00008601,吉住家住宅主屋,よしずみけじゅうたくしゅおく,1棟,,登録有形文化財(建造物),住宅,建築物,,昭和前,昭和4年,1929,木造2階建、瓦葺、建築面積108㎡,,40 － 0065,69,2011.01.26(平成23.01.26),2011.01.26(平成23.01.26),,20110126,,造形の規範となっているもの,,福岡県,福岡県福岡市博多区上呉服町273,,,,,33.59889000000000,130.41260000000000,博多西門通りに北面する。間口五・五メートルの二階建。渡り廊下を介して台所棟を背面に付設。いずれも切妻造桟瓦葺。二階に座敷、一階に通り土間と仏間等を設ける。正面に庇を付け、二階に格子戸をたて、一階を全面ガラス戸とし、近代的な町家構えをつくる。,https://bunka.nii.ac.jp/heritage/43967/_134997/43967_134997111225034538209_300.jpg
101,00008602,浄福寺鐘楼,じょうふくじしょうろう,1棟,,登録有形文化財(建造物),宗教,その他工作,,江戸,江戸後期／明治中期・昭和50年移築,1751-1830／1883-1897・1975移築,木造、瓦葺、面積8.4㎡,,40 － 0066,69,2011.01.26(平成23.01.26),2011.01.26(平成23.01.26),,20110126,,造形の規範となっているもの,,福岡県,福岡県福岡市南区桧原6-897-7,,宗教法人浄福寺,,,33.53186000000000,130.38520000000000,方一間で、四周吹放ちとする。礎盤上に円柱を内転びにたて、腰貫や長押、台輪で固め、尾垂木付二手先を詰組とし、一軒扇垂木を配る。妻木連格子の入母屋造本瓦葺。中央を鏡天井とする化粧屋根裏天井で、彫刻欄間や地紋彫を飾る。秀逸な意匠になる吹放ち鐘楼。,https://bunka.nii.ac.jp/heritage/43967/_134998/43967_134998111225034539828_300.jpg
101,00008603,旧林田春次郎家住宅本屋,きゅうはやしだはるじろうけじゅうたくほんや,1棟,,登録有形文化財(建造物),住宅,建築物,,大正,大正3年／昭和後期改修,1914／1966-1989改修,木造平屋一部2階建、瓦葺、建築面積210㎡,,40 － 0067,69,2011.01.26(平成23.01.26),2011.01.26(平成23.01.26),,20110126,,国土の歴史的景観に寄与しているもの,,福岡県,福岡県田川市新町3330-1他,,,,,33.64467000000000,130.81060000000000,市街地の高台に占める敷地中央に東面して建つ。東西棟の入母屋造妻入桟瓦葺、木造二階建と、その北面に付く入母屋造平屋建からなる。建築面積二一〇平方メートル。平屋部分は前後二列の六間取で、前列北室にトコを構える。変化のある外観を構成する近代の住宅。,https://bunka.nii.ac.jp/heritage/43967/_134999/43967_134999024525153114600_300.jpg
101,00008604,旧林田春次郎家住宅迎賓館,きゅうはやしだはるじろうけじゅうたくげいひんかん,1棟,,登録有形文化財(建造物),住宅,建築物,,昭和前,昭和9年／昭和後期改修,1934／1966-1989改修,木造2階建、銅板葺、建築面積124㎡,,40 － 0068,69,2011.01.26(平成23.01.26),2011.01.26(平成23.01.26),,20110126,,造形の規範となっているもの,,福岡県,福岡県田川市新町3330-1他,,,,,33.64486000000000,130.81070000000000,主屋の北方に位置する木造二階建。入母屋造銅板葺の緩やかな屋根になる。一階に小部屋、二階に大広間と次の間を配し、香春岳を望む東面に広縁を設ける。大広間北端にトコと棚を構え、その東北には瀟洒な角部屋を造る。銘木を用い、優れた和風意匠が印象的。,https://bunka.nii.ac.jp/heritage/43967/_135000/43967_135000026478084405866_300.jpg
101,00009078,筑紫女学園洗心庵,ちくしじょがくえんせんしんあん,1棟,,登録有形文化財(建造物),学校,建築物,,昭和前,昭和15年／平成15年改修,1940/2003改修,木造平屋建、瓦葺一部銅板葺、建築面積38㎡,,40 － 0069,71,2011.10.28(平成23.10.28),2011.10.28(平成23.10.28),,20111028,,国土の歴史的景観に寄与しているもの,,福岡県,福岡県福岡市中央区警固2-24-3,,学校法人筑紫女学園,非営利法人,,33.58280000000000,130.38900000000000,校地の東北隅に位置する。北に四畳半の茶室、南に六畳の水屋を配し、茶室には台目のトコを構え、水屋にも丸炉を切る。屋根は東西棟からＴ字型に南北棟が延び、妻などに土庇を付設する。丸太柱を多用し、外壁は漆喰仕上げとする。軽快で変化に富む外観をなす。,https://bunka.nii.ac.jp/heritage/43967/_162438/43967_162438140216024932348_300.jpg
101,00009079,筑紫女学園待合,ちくしじょがくえんまちあい,1棟,,登録有形文化財(建造物),学校,建築物,,昭和前,昭和15年／平成15年改修,1940/2003改修,木造平屋建、杉皮葺、建築面積1.4㎡,,40 － 0070,71,2011.10.28(平成23.10.28),2011.10.28(平成23.10.28),,20111028,,国土の歴史的景観に寄与しているもの,,福岡県,福岡県福岡市中央区警固2-24-3,,学校法人筑紫女学園,非営利法人,,33.58275000000000,130.38910000000000,洗心庵東南に位置する。桁行1.8メートル梁間南0.9メートル北0.6メートル、招屋根杉皮葺。丸太柱で側・背面を漆喰仕上げ真壁とし、南妻に下地窓を開ける。南北で妻壁の出を変え、座板は途中で折れ、杉板と竹を交互に張る。繊細なデザインの庭園建築。,https://bunka.nii.ac.jp/heritage/43967/_162439/43967_162439140216024934650_300.jpg
101,00009080,筑紫女学園香風亭,ちくしじょがくえんこうふうてい,1棟,,登録有形文化財(建造物),学校,建築物,,昭和中,昭和30年／平成15年改修,1955/2003改修,木造平屋建、瓦葺一部銅板葺、建築面積123㎡,,40 － 0071,71,2011.10.28(平成23.10.28),2011.10.28(平成23.10.28),,20111028,,国土の歴史的景観に寄与しているもの,,福岡県,福岡県福岡市中央区警固2-24-3,,学校法人筑紫女学園,非営利法人,,33.58267000000000,130.38890000000000,洗心庵の南に位置する。南北棟の切妻造桟瓦葺で、軒先を銅板葺とし、北面に角屋を付設する。十畳の主座敷と十五畳の次の間を中心に縁を廻らして下屋とし、三畳台目の茶室や納戸、玄関を付ける。装飾を廃した開放的な書院座敷で、品格ある雰囲気を有する。,https://bunka.nii.ac.jp/heritage/43967/_162440/43967_162440140216024937867_300.jpg
101,00009228,南久保田家住宅主屋,みなみくぼたけじゅうたくしゅおく,1棟,,登録有形文化財(建造物),住宅,建築物,,大正,大正4年,1915,木造平屋一部2階建、瓦葺、建築面積427㎡,,,72,2012.02.23(平成24.02.23),2012.02.23(平成24.02.23),,20120223,,国土の歴史的景観に寄与しているもの,,福岡県,福岡県うきは市吉井町福永字屋敷160-2,,,,,33.35212000000000,130.76400000000000,敷地中央に東面し、桁行24.6メートル梁間12.8メートルで、西に納戸、北に便所を張出す。木造平屋1部2階建、入母屋造桟瓦葺で、2階外壁は大壁で重厚な構えとする。18畳主室にスギ板の鏡天井を張るなど、長大材を用いた雄大なつくりになる大型民家。,https://bunka.nii.ac.jp/heritage/43967/_164781/43967_164781140222025159794_300.jpg
101,00009229,南久保田家住宅米蔵,みなみくぼたけじゅうたくこめぐら,1棟,,登録有形文化財(建造物),住宅,建築物,,明治,明治32年,1899,木造平屋一部2階建、瓦葺、建築面積69㎡,,,72,2012.02.23(平成24.02.23),2012.02.23(平成24.02.23),,20120223,,国土の歴史的景観に寄与しているもの,,福岡県,福岡県うきは市吉井町福永字屋敷160-2,,,,,33.35219000000000,130.76360000000000,敷地北西隅に南北棟で建ち、桁行9.9メートル梁間6.9メートル、木造平屋1部2階建、切妻造妻入、桟瓦葺である。布石積基礎上に建ち、外壁は真壁漆喰塗で、北面に下見板を張り、1階内部を土間とする。明治期の屋敷構えを伝える、建ちの高い米蔵である。,https://bunka.nii.ac.jp/heritage/43967/_164782/43967_164782140222025200581_300.jpg
101,00009230,南久保田家住宅古蔵,みなみくぼたけじゅうたくふるぐら,1棟,,登録有形文化財(建造物),住宅,建築物,,明治,明治前期,1868～1882,木造2階建、瓦葺、建築面積38㎡,,,72,2012.02.23(平成24.02.23),2012.02.23(平成24.02.23),,20120223,,国土の歴史的景観に寄与しているもの,,福岡県,福岡県うきは市吉井町福永字屋敷160-2,,,,,33.35219000000000,130.76370000000000,米蔵の東側に東西棟で建ち、桁行7.8メートル梁間4.9メートル、木造2階建、切妻造桟瓦葺で、南面出入口に庇を付ける。外壁は大壁漆喰塗で軒裏まで塗込め、腰を竪板張とする。明治28年の家相図に確認される蔵で、往時の屋敷構えを伝える。,https://bunka.nii.ac.jp/heritage/43967/_164783/43967_164783140222025201587_300.jpg
101,00009231,南久保田家住宅ツキアタリ蔵,みなみくぼたけじゅうたくつきあたりぐら,1棟,,登録有形文化財(建造物),住宅,建築物,,大正,大正後期,1919～1926,木造2階建、瓦葺、建築面積56㎡,,,72,2012.02.23(平成24.02.23),2012.02.23(平成24.02.23),,20120223,,国土の歴史的景観に寄与しているもの,,福岡県,福岡県うきは市吉井町福永字屋敷160-2,,,,,33.35213000000000,130.76360000000000,米蔵と農業倉庫の間に南北棟で建ち、桁行9.9メートル梁間4.9メートル、木造2階建、切妻造桟瓦葺で、出入口のある東面全長に下屋を付け、薪置場などに区画する。外壁は大壁漆喰塗で腰に竪板を張る。1階は土間で、2階を床板張とする、もと家財蔵。,https://bunka.nii.ac.jp/heritage/43967/_164784/43967_164784140222025203583_300.jpg
101,00009232,南久保田家住宅味噌部屋,みなみくぼたけじゅうたくみそべや,1棟,,登録有形文化財(建造物),住宅,建築物,,大正,大正前期,1912～1918,木造平屋建、瓦葺、建築面積27㎡,,,72,2012.02.23(平成24.02.23),2012.02.23(平成24.02.23),,20120223,,国土の歴史的景観に寄与しているもの,,福岡県,福岡県うきは市吉井町福永字屋敷160-2,,,,,33.35190000000000,130.76390000000000,主屋南側の水路脇に南北棟で建ち、桁行6.7メートル梁間4.0メートル、木造平屋建、切妻造妻入、桟瓦葺である。外壁は真壁漆喰塗で腰を竪板張とする。内部は土間で、主屋の土間に向く北面を出入口として庇を付ける。旧家の生活様態を伝える建物である。,https://bunka.nii.ac.jp/heritage/43967/_164785/43967_164785140222025204439_300.jpg
101,00009233,南久保田家住宅農業倉庫,みなみくぼたけじゅうたくのうぎょうそうこ,1棟,,登録有形文化財(建造物),住宅,建築物,,昭和前,昭和10年,1935,木造2階建、瓦葺、建築面積89㎡,,,72,2012.02.23(平成24.02.23),2012.02.23(平成24.02.23),,20120223,,国土の歴史的景観に寄与しているもの,,福岡県,福岡県うきは市吉井町福永字屋敷160-2,,,,,33.35195000000000,130.76370000000000,敷地南西隅に東西棟で建ち、桁行12.9メートル梁間6.9メートル、木造2階建、切妻造桟瓦葺で、南面1間通りを下屋として、屋敷外からの出入りの可能なつくりとする。外壁は竪板張とし、内部は納屋などに仕切る。農作との関連を示す大型倉庫である。,https://bunka.nii.ac.jp/heritage/43967/_164786/43967_164786140222025205434_300.jpg
101,00009234,南久保田家住宅材木置場及び脇門,みなみくぼたけじゅうたくざいもくおきばおよびわきもん,1棟,,登録有形文化財(建造物),住宅,建築物,,大正,大正4年頃,1915頃,木造平屋建、瓦葺、建築面積44㎡,,,72,2012.02.23(平成24.02.23),2012.02.23(平成24.02.23),,20120223,,国土の歴史的景観に寄与しているもの,,福岡県,福岡県うきは市吉井町福永字屋敷160-2,,,,,33.35190000000000,130.76420000000000,主屋南東隅に5畳大の脇部屋を建て、その東側に脇門を開き、さらに矩折れに材木置場を延ばす。延長23.5メートル、木造、切妻造桟瓦葺である。材木置場は、表庭側を漆喰塗とし、裏側は吹放ちとして材木等を納める。屋敷の表構えと実用を兼ねた建物。,https://bunka.nii.ac.jp/heritage/43967/_164787/43967_164787140222025206245_300.jpg
101,00009235,南久保田家住宅裏門,みなみくぼたけじゅうたくうらもん,1棟,,登録有形文化財(建造物),住宅,建築物,,大正,大正4年頃,1915頃,木造平屋建、瓦葺、建築面積11㎡,,,72,2012.02.23(平成24.02.23),2012.02.23(平成24.02.23),,20120223,,国土の歴史的景観に寄与しているもの,,福岡県,福岡県うきは市吉井町福永字屋敷160-2,,,,,33.35190000000000,130.76380000000000,主屋の南西側、農業倉庫の東隣に東西棟で並び建ち、桁行5.2メートル梁間2.1メートル、木造平屋建、切妻造桟瓦葺である。南面東寄りに門を開き、両開き板戸を吊る。外壁は漆喰塗及び竪板張とする。小規模ながら堅実なつくりになる裏門である。,https://bunka.nii.ac.jp/heritage/43967/_164788/43967_164788140222025207830_300.jpg
101,00009403,旧小倉警察署庁舎（旧岡田医院）,きゅうこくらけいさつしょちょうしゃ（きゅうおかだいいん）,1棟,,登録有形文化財(建造物),官公庁舎,建築物,,明治,明治23年／昭和4年・昭和後期・平成18年改修,1890／1929・1966～1989・2006改修,木造2階建、瓦葺、建築面積162㎡,,40 － 0080,73,2012.08.13(平成24.08.13),2012.08.13(平成24.08.13),,20120813,,国土の歴史的景観に寄与しているもの,,福岡県,福岡県北九州市小倉北区室町2-42-8,,株式会社聖林公司,営利法人,,33.88628000000000,130.87630000000000,紫川畔の角地に建つ。木造二階建、建築面積一六二平方メートル、寄棟造桟瓦葺で、南角に張出す玄関に円柱で支持した庇を付す。外壁は横板張で上げ下げ窓を連続させ、軒に蛇腹を廻らすなど洋風意匠とする。建築年代の明らかなものとして県内最古の庁舎建築。,https://bunka.nii.ac.jp/heritage/43967/_194196/43967_194196217831540401630_300.jpg
101,00009538,上野ビル（旧三菱合資会社若松支店）本館,うえのびる（きゅうみつびしごうしがいしゃわかまつしてん）　ほんかん,1棟,,登録有形文化財(建造物),産業3次,建築物,,大正,大正2年,1913,煉瓦造3階建、建築面積465㎡,,40 － 0081,74,2013.03.29(平成25.03.29),2013.03.29(平成25.03.29),,20130329,,造形の規範となっているもの,,福岡県,福岡県北九州市若松区本町1-14-1他,,上野海運株式会社,営利法人,,33.90256000000000,130.81390000000000,若松港に面して建つ。煉瓦造三階建、建築面積四六五平方メートル、陸屋根である。左右対称の正面で、中央に玄関を突出する。縦長窓を規則的に配した重厚な外観に対して、内部は中央の吹き抜けを取り、鋳鉄製の柱やステンドグラスを用いて華やかに仕上げる。,https://bunka.nii.ac.jp/heritage/43967/_194331/43967_194331140908092910265_300.jpg
101,00009539,上野ビル（旧三菱合資会社若松支店）倉庫棟,うえのびる（きゅうみつびしごうしがいしゃわかまつしてん）　そうことう,1棟,,登録有形文化財(建造物),産業3次,建築物,,大正,大正2年,1913,煉瓦造2階建、瓦葺、建築面積190㎡,,40 － 0082,74,2013.03.29(平成25.03.29),2013.03.29(平成25.03.29),,20130329,,造形の規範となっているもの,,福岡県,福岡県北九州市若松区本町1-14-1他,,上野海運株式会社,営利法人,,33.90243000000000,130.81370000000000,本館の西側に東面して建つ。煉瓦造二階建、建築面積一九〇平方メートル、切妻造瓦葺、L字形の平面とし、東面に突出した妻に三菱の社標を掲げる。基礎や窓まわりに石材を用いるなど簡素ながらも確かなつくりで、当時の煉瓦造倉庫の技術的水準を示す。,https://bunka.nii.ac.jp/heritage/43967/_194332/43967_194332140908092912728_300.jpg
101,00009540,上野ビル（旧三菱合資会社若松支店）旧分析室,うえのびる（きゅうみつびしごうしがいしゃわかまつしてん）　きゅうぶんせきしつ,1棟,,登録有形文化財(建造物),産業3次,建築物,,大正,大正2年,1913,木造平屋建、瓦葺、建築面積119㎡,,40 － 0083,74,2013.03.29(平成25.03.29),2013.03.29(平成25.03.29),,20130329,,造形の規範となっているもの,,福岡県,福岡県北九州市若松区本町1-14-1他,,上野海運株式会社,営利法人,,33.90272000000000,130.81380000000000,倉庫棟の北側に東面にして建つ。木造平屋建、建築面積一一九平方メートル、切妻造瓦葺である。煉瓦造の周囲の建物にあわせて大壁造とし、窓は縦長窓、腰壁はスクラッチタイル張とする。石炭の品質分析を行った、石炭会社の現地事務所を特徴づける建物である。,https://bunka.nii.ac.jp/heritage/43967/_194333/43967_194333140908092914910_300.jpg
101,00009541,上野ビル（旧三菱合資会社若松支店）門柱及び塀,うえのびる（きゅうみつびしごうしがいしゃわかまつしてん）　もんちゅうおよびへい,1基,,登録有形文化財(建造物),産業3次,その他工作,,大正,大正2年,1913,門柱　煉瓦造門柱6基　塀　煉瓦造、総延長115m,,40 － 0084,74,2013.03.29(平成25.03.29),2013.03.29(平成25.03.29),,20130329,,造形の規範となっているもの,,福岡県,福岡県北九州市若松区本町1-14-1他,,上野海運株式会社,営利法人,,33.90233000000000,130.81400000000000,敷地正面である南面の東寄りと、北面の東寄りと西寄りの三箇所に門を開き、南、東、北の三面に塀を廻らす。煉瓦造、塀は総長一一五メートル、正門の門柱は高さ二・三メートルを測る。建設当時の姿をよく残し、石炭会社の現地事務所の構えを伝える。,https://bunka.nii.ac.jp/heritage/43967/_194334/43967_194334140908092916960_300.jpg
101,00009542,多田家住宅主屋,ただけじゅうたくしゅおく,1棟,,登録有形文化財(建造物),住宅,建築物,,明治,明治23年,1890,木造平屋一部2階建、瓦葺、建築面積337㎡,,40 － 0085,74,2013.03.29(平成25.03.29),2013.03.29(平成25.03.29),,20130329,,国土の歴史的景観に寄与しているもの,,福岡県,福岡県朝倉郡筑前町森山字耳取417-1,,,,,33.45249000000000,130.62250000000000,敷地中央に南面し、木造平屋一部二階建、入母屋造桟瓦葺である。西側を高い吹抜けの土間とし、床上部は居室を二列並べ、東列南面に一〇畳座敷を張出して鍵座敷型に配置する。外観は南西面を漆喰で塗込め重厚な外観とする。風格ある構えの大規模民家。,https://bunka.nii.ac.jp/heritage/43967/_194335/43967_194335140916101104811_300.jpg
101,00009543,多田家住宅離れ及び渡廊下,ただけじゅうたくはなれおよびわたりろうか,1棟,,登録有形文化財(建造物),住宅,建築物,,明治,明治35年,1902,木造平屋建、瓦葺、建築面積100㎡,,40 － 0086,74,2013.03.29(平成25.03.29),2013.03.29(平成25.03.29),,20130329,,国土の歴史的景観に寄与しているもの,,福岡県,福岡県朝倉郡筑前町森山字耳取417-1,,,,,33.45242000000000,130.62270000000000,主屋南東隅から敷地南辺沿いに渡廊下をのばし、太鼓橋を介して離れに接続する。離れは木造平屋建、寄棟造桟瓦葺で、庭側は縁高欄を廻らし、南面は広縁から集落を見晴らす。主室の座敷飾りに銘木を用い、軒は垂木を扇に配るなど、瀟洒で開放的なつくりの離れ。,https://bunka.nii.ac.jp/heritage/43967/_194336/43967_194336140916101105909_300.jpg
