台帳ID,管理対象ID,名称,ふりがな,員数,棟名,文化財種類,種別1,種別2,国,時代,年代,西暦,構造及び形式等,その他参考となるべき事項,登録番号,登録回,登録告示年月日,登録年月日,追加年月日,重文指定年月日,国宝指定年月日,登録基準1,登録基準2,都道府県,所在地,保管施設の名称,所有者名,所有者種別,管理団体又は責任者,緯度,経度,解説文,画像URL
101,00000175,旧九州鉄道城山三連橋梁,きゅうきゅうしゅうてつどうきやまさんれんきょうりょう,1基,,登録有形文化財(建造物),交通,土木構造物,,明治,明治22,1889,煉瓦造3連アーチ橋，延長24.5m，幅4.7m,,40 － 0002,2,1997.05.29(平成9.05.29),1997.05.07(平成9.05.07),,19970507,,国土の歴史的景観に寄与しているもの,,福岡県,福岡県筑紫野市大字永岡,,筑紫野市,,,33.46610000000000,130.53610000000000,幅４．７ｍ，延長２４．５ｍの煉瓦造の三連アーチ橋梁で，アーチ橋としては中規模な遺構である。中央部のアーチ下は河川，両脇アーチ下が道路となっている。簡素な構成のアーチ橋であるが，九州で最も早い時期に造られた煉瓦造橋梁として広く知られている。,https://bunka.nii.ac.jp/heritage/43967/_101165/43967_101165111225010440828_300.jpg
101,00000315,九州マクセル赤煉瓦記念館（旧三菱方城炭礦坑務工作室）,きゅうしゅうまくせるあかれんがきねんかん（きゅうみつびしほうじょうたんこうこうむこうさくしつ）,1棟,,登録有形文化財(建造物),産業1次,建築物,,明治,明治37頃,1904頃,煉瓦造2階建塔屋付，スレート葺，建築面積297㎡,,40 － 0003,5,1997.09.16(平成9.09.16),1997.09.03(平成9.09.03),,19970903,,国土の歴史的景観に寄与しているもの,,福岡県,福岡県田川郡福智町伊方4680,,マクセル株式会社,,,33.68257000000000,130.79210000000000,明治３５年に開削に着手した方城炭礦の開発時の施設で，建設当初は扇風機室として利用された。煉瓦造，２階建で，通りに面した一部を３階建てとする。使用された煉瓦は炭礦開発のために特別に焼成したものと伝え，炭礦の往事の様子をよく示す施設である。,https://bunka.nii.ac.jp/heritage/43967/_101305/43967_101305091397832394424_300.jpg
101,00000490,旧三池炭鉱宮浦坑煙突,きゅうみいけたんこうみやうらこうえんとつ,1基,,登録有形文化財(建造物),産業1次,その他工作,,明治,明治21,1888,煉瓦造煙突，高さ31.2m，基部直径4.3m,,40 － 0004,8,1998.02.12(平成10.02.12),1998.01.16(平成10.01.16),,19980116,,国土の歴史的景観に寄与しているもの,,福岡県,福岡県大牟田市西宮浦町132-8,,大牟田市,,,33.02903000000000,130.45480000000000,明治２０年に開削に着手した炭鉱に残る煉瓦造の円形煙突。蒸気動力のボイラーの排煙を目的に建設された。電化にともない多くの煙突が失われたため，三池炭鉱に現存する唯一の煙突となった。「炭鉱節」に唄われた三池炭鉱の煙突として広く親しまれている。,https://bunka.nii.ac.jp/heritage/43967/_101480/43967_101480111225010800039_300.jpg
101,00001083,草野歴史資料館（旧草野銀行本店）,くさのれきししりょうかん（きゅうくさのぎんこうほんてん）,1棟,,登録有形文化財(建造物),産業3次,建築物,,明治,明治44,1911,木造２階建，瓦葺，建築面積177㎡,,40 － 0005,16,1999.03.12(平成11.03.12),1999.02.17(平成11.02.17),,19990217,,造形の規範となっているもの,,福岡県,福岡県久留米市草野町草野411-1,,久留米市,,,33.31929000000000,130.63540000000000,久留米市の東部，旧御井郡の中心地として栄えた草野地区の地元銀行建築。木造平屋建，瓦葺寄棟屋根，下見板貼りの銀行店舗で，正面に千鳥破風の車寄ポーチを突き出す。門扉，鉄柵もよく遺されており，地方銀行の様子を今に伝える。,https://bunka.nii.ac.jp/heritage/43967/_102073/43967_102073111225011444309_300.jpg
101,00001084,山辺道文化館（旧中野病院）診療棟,やまべのみちぶんかかん（きゅうなかのびょういん）しんりょうとう,1棟,,登録有形文化財(建造物),文化福祉,建築物,,大正,大正3頃,1914頃,木造２階建，瓦葺，建築面積270㎡,,40 － 0006,16,1999.03.12(平成11.03.12),1999.02.17(平成11.02.17),,19990217,,造形の規範となっているもの,,福岡県,福岡県久留米市草野町草野487-1,,久留米市,,,33.31816000000000,130.63330000000000,久留米市の東方，草野地区に建つ大型の病院建築。煉瓦造基礎，木造下見板貼りの左右対称形の建物で，正面中央部を２階建とし，玄関上部にバルコニーを設ける。２階寄棟屋根から前面に突き出したペディメントの蟇股大瓶束風の飾りはユニーク。,https://bunka.nii.ac.jp/heritage/43967/_102074/43967_102074111225011444571_300.jpg
101,00001085,山辺道文化館（旧中野病院）倉庫,やまべのみちぶんかかん（きゅうなかのびょういん）そうこ,1棟,,登録有形文化財(建造物),文化福祉,建築物,,大正,大正3頃,1914頃,木造平屋建，瓦葺，建築面積26㎡,,40 － 0007,16,1999.03.12(平成11.03.12),1999.02.17(平成11.02.17),,19990217,,造形の規範となっているもの,,福岡県,福岡県久留米市草野町草野487-1,,久留米市,,,33.31809000000000,130.63310000000000,診療棟の背後，南西方に建つ木造平屋建，桟瓦葺，寄棟屋根の倉庫建物。診療棟と同様，下見板貼りで軒下と腰を縦羽目とする。北面の東端と南面の中央東寄りに出入口を設け，内開き窓の外側に外開きの１枚戸を付けて盗難避けとしている。,https://bunka.nii.ac.jp/heritage/43967/_102075/43967_102075111225011445084_300.jpg
101,00001148,北九州市旧大阪商船,きたきゅうしゅうしきゅうおおさかしょうせん,1棟,,登録有形文化財(建造物),交通,建築物,,大正,大正6,1917,木造一部コンクリート造２階建，建築面積670㎡,,40 － 0008,17,1999.07.19(平成11.07.19),1999.06.07(平成11.06.07),,19990607,,国土の歴史的景観に寄与しているもの,,福岡県,福岡県北九州市門司区港町7-18,,北九州市,,,33.94612000000000,130.96220000000000,門司港のランドマークとして広く親しまれている。辰野式フリークラシックのセセッション化を一段と押し進めた作品としても知られる。設計は大阪建築士の草分け的存在である河合幾次。現在は市有化されて海事・イベント館として活用されている。,https://bunka.nii.ac.jp/heritage/43967/_102138/43967_102138111225011518785_300.jpg
101,00001149,草野歴史資料館（旧草野銀行本店）門,くさのれきししりょうかん（きゅうくさのぎんこうほんてん）もん,1基,,登録有形文化財(建造物),産業3次,その他工作,,明治,明治41,1908,石造，幅員2.9m，左右柵基壇18.7m附属,,40 － 0009,17,1999.07.19(平成11.07.19),1999.06.07(平成11.06.07),,19990607,,国土の歴史的景観に寄与しているもの,,福岡県,福岡県久留米市草野町草野411-1,,久留米市,,,33.31942000000000,130.63530000000000,銀行本館の前庭を前面街路と側面街路に沿って鈎型に囲うもので、正面中央に正門、側面に通用門を設け、高欄風の石造土台の上に鉄柵を建てる。資料館開館（昭和５９年）にあたり復元された門扉と鉄柵は地方銀行におけるアプローチ空間の有様をよく伝える。,https://bunka.nii.ac.jp/heritage/43967/_132577/43967_132577111225011520697_300.jpg
101,00001308,門司区役所（旧門司市役所）,もじくやくしょ（きゅうもじしやくしょ）,1棟,,登録有形文化財(建造物),官公庁舎,建築物,,昭和前,昭和5,1930,鉄筋コンクリート造３階建，建築面積1854㎡,,40 － 0010,19,1999.09.07(平成11.09.07),1999.08.23(平成11.08.23),,19990823,,造形の規範となっているもの,,福岡県,福岡県北九州市門司区清滝1-1-1,,北九州市,,,33.94118000000000,130.95960000000000,門司港とJR門司港駅を見下ろす丘の上に建つ。玄関ポーチなどに装飾的要素を残すものの、全体としては無装飾のインターナショナルスタイルを基調とする。左右対称で建物の隅を曲線で処理しているのが特徴。設計は九州帝大建築課長であった倉田謙による。,https://bunka.nii.ac.jp/heritage/43967/_102298/43967_102298111225011701189_300.jpg
101,00001458,内田三連橋梁,うちださんれんきょうりょう,1基,,登録有形文化財(建造物),交通,土木構造物,,明治,明治28,1895,煉瓦造3連アーチ橋、橋長17m、幅員12m,,40 － 0011,21,1999.12.02(平成11.12.02),1999.11.18(平成11.11.18),,19991118,,国土の歴史的景観に寄与しているもの,,福岡県,福岡県田川郡赤村大字内田1804-1他,,平成筑豊鉄道株式会社,,,33.62870000000000,130.86690000000000,筑豊地方の運炭鉄道網拡充のために設立された豊州鉄道株式会社が油須原－香春間に建設した橋長１７ｍの煉瓦造３連アーチ橋。上流側壁面には切石が貼られているが，下流側は複線化を考慮し凹凸をつけて煉瓦が積まれており，結果として装飾的になっている。,https://bunka.nii.ac.jp/heritage/43967/_102448/43967_102448111225011837582_300.jpg
101,00001459,石坂トンネル（第２隧道）,いしざかとんねる（だいにずいどう）,1基,,登録有形文化財(建造物),交通,土木構造物,,明治,明治28,1895,煉瓦造、全長75m、幅8.1m、石造・煉瓦造坑口,,40 － 0012,21,1999.12.02(平成11.12.02),1999.11.18(平成11.11.18),,19991118,,国土の歴史的景観に寄与しているもの,,福岡県,福岡県田川郡赤村大字赤6938-2～京都郡みやこ町大字崎山字石坂1506-2,,平成筑豊鉄道株式会社,,,33.61706000000000,130.89900000000000,豊州鉄道株式会社が石坂峠付近の大坂山の岩盤に掘削した全長７５ｍ、曲線平面の煉瓦造隧道。複線仕様の扁平な馬蹄形坑口を持つ。坑門は切石積みでアーチ部のみ煉瓦で構成し，坑門端部で迫り出した門柱状の意匠によりポータルを造る。担当技師は野辺地久記。,https://bunka.nii.ac.jp/heritage/43967/_102449/43967_102449111225011838122_300.jpg
101,00001755,呉川眼鏡橋,くれかわめがねばし,1基,,登録有形文化財(建造物),交通,土木構造物,,明治,明治19,1886,石造単アーチ橋、橋長8.6m、幅員4.2m,,40 － 0013,24,2000.05.25(平成12.05.25),2000.04.28(平成12.04.28),,20000428,,国土の歴史的景観に寄与しているもの,,福岡県,福岡県田川郡香春町大字鏡山1113、1497,,香春町,,,33.67737000000000,130.87530000000000,１級河川遠賀川水系の呉川に架かる石造単アーチ橋。橋長８．６ｍ、幅員４．２ｍの規模を持ち、アーチは半径約３ｍのほぼ半円形をしている。切石の花崗岩が整然と布積みされた充腹アーチが、周囲の自然景観に溶け込んでいる。,https://bunka.nii.ac.jp/heritage/43967/_102745/43967_102745111225012144802_300.jpg
101,00001756,仲哀隧道,ちゅうあいずいどう,1基,,登録有形文化財(建造物),交通,土木構造物,,明治,明治22,1889,煉瓦造坑口、延長432m,,40 － 0014,24,2000.05.25(平成12.05.25),2000.04.28(平成12.04.28),,20000428,,国土の歴史的景観に寄与しているもの,,福岡県,福岡県田川郡香春町大字鏡山1073～京都郡みやこ町大字松田2032-6,,香春町、みやこ町,,,33.68114000000000,130.88230000000000,筑豊で採掘された石炭等を運搬するために掘削された全長４３２ｍの隧道。隧道内壁の両端部は煉瓦及び石造で、その他の部分は素堀りとする。馬蹄形の坑口周りを花崗岩の切石とし、煉瓦積みの坑門が門柱状の意匠で飾られる。,https://bunka.nii.ac.jp/heritage/43967/_102746/43967_102746111225012145056_300.jpg
101,00002097,旧三池炭鉱三川電鉄変電所（信号電材株式会社本社）,きゅうみいけたんこうみかわでんてつへんでんしょ（しんごうでんざいかぶしきがいしゃほんしゃ）,1棟,,登録有形文化財(建造物),交通,建築物,,明治,明治42頃,1909頃,煉瓦造平屋建、スレート葺、建築面積462㎡,,40 － 0015,27,2000.12.20(平成12.12.20),2000.12.04(平成12.12.04),,20001204,,国土の歴史的景観に寄与しているもの,,福岡県,福岡県大牟田市新港町1-30,,信号電材 株式会社,,,33.01154000000000,130.42540000000000,三池港に通じる三池炭鉱専用鉄道用の旧変電所。規模がほぼ等しい煉瓦造切妻平屋建の建屋が２棟並列する。妻面にバラ窓風の開口部を設け，側面には窓台に砂岩を用いたアーチ形窓が並ぶ。民間会社が保存を図りつつ社屋として活用している。,https://bunka.nii.ac.jp/heritage/43967/_103087/43967_103087914274100358861_300.jpg
101,00002098,鶴味噌並倉北棟,つるみそなみくらきたとう,1棟,,登録有形文化財(建造物),産業2次,建築物,,大正,大正7,1918,煉瓦造平屋建、瓦葺、建築面積62㎡,,40 － 0016,27,2000.12.20(平成12.12.20),2000.12.04(平成12.12.04),,20001204,,国土の歴史的景観に寄与しているもの,,福岡県,福岡県柳川市三橋町江曲216,,鶴味噌醸造株式会社,,,33.16079000000000,130.40920000000000,三橋町と柳川市との境を流れる掘割に沿って建つ。煉瓦造平屋建，切妻造桟瓦葺の旧麹室で，鋸歯飾りをあしらった胴蛇腹，妻面に円形換気窓を設ける。中棟との間に設けた庇部に，妻面に合わせて煉瓦壁を延ばし，半円アーチ形の開口部を穿つ。,https://bunka.nii.ac.jp/heritage/43967/_103088/43967_103088111225012535629_300.jpg
101,00002099,鶴味噌並倉中棟,つるみそなみくらなかとう,1棟,,登録有形文化財(建造物),産業2次,建築物,,大正,大正初期,1912-1925,煉瓦造平屋建、瓦葺、建築面積45㎡,,40 － 0017,27,2000.12.20(平成12.12.20),2000.12.04(平成12.12.04),,20001204,,国土の歴史的景観に寄与しているもの,,福岡県,福岡県柳川市三橋町江曲216,,鶴味噌醸造株式会社,,,33.16074000000000,130.40920000000000,３棟の内，煉瓦造蔵として最初に建てられたと伝わる。妻面を木造横板貼とし，フランス積の壁面に北・南棟で模される櫛形アーチ開口部を２箇所設ける。登梁を中柱で支えた和小屋を載せる。他棟と類似しつつ，微妙に変化をもつ外観が水辺景観を豊かにしている。,https://bunka.nii.ac.jp/heritage/43967/_103089/43967_103089111225012535891_300.jpg
101,00002100,鶴味噌並倉南棟,つるみそなみくらみなみとう,1棟,,登録有形文化財(建造物),産業2次,建築物,,明治,明治39頃／大正7増築,1906頃／1918増築,煉瓦造平屋建、瓦葺、建築面積70㎡,,40 － 0018,27,2000.12.20(平成12.12.20),2000.12.04(平成12.12.04),,20001204,,国土の歴史的景観に寄与しているもの,,福岡県,福岡県柳川市三橋町江曲216,,鶴味噌醸造株式会社,,,33.16068000000000,130.40920000000000,北棟と類似した外観。キングポストトラスの小屋組を載せ，小規模な切妻屋根を冠す中棟との間隙に煉瓦壁を築き，鋸歯飾りの胴蛇腹によって主棟との連続性を持つ。３棟の煉瓦妻面が掘割に面する並倉は，水郷柳川の歴史的景観形成に大きく寄与している。,https://bunka.nii.ac.jp/heritage/43967/_103090/43967_103090111225012536147_300.jpg
101,00002700,旧蔵内家住宅大玄関棟,きゅうくらうちけじゅうたくおおげんかんとう,1棟,,登録有形文化財(建造物),住宅,建築物,,大正,大正9,1920,木造平屋建、銅板葺、建築面積147㎡,,40 － 0019,32,2002.03.12(平成14.03.12),2002.02.14(平成14.02.14),,20020214,,国土の歴史的景観に寄与しているもの,,福岡県,福岡県築上郡築上町大字上深野396,,,,,33.63658000000000,130.99470000000000,主屋をはじめとする建築群の正面に建つ。戸袋に貼られた新聞より大正９年の建設と判明する。東面して建つ銅板葺の妻入建物で，屋根はＴ字型の大棟として東・南・北に妻飾を設け，その周囲にも一段低い屋根を架ける。全体として変化に富む外観を構成している。,https://bunka.nii.ac.jp/heritage/43967/_103690/43967_103690111225013148975_300.jpg
101,00002701,旧蔵内家住宅応接間棟,きゅうくらうちけじゅうたくおうせつまとう,1棟,,登録有形文化財(建造物),住宅,建築物,,明治,明治20,1887,木造平屋建、瓦葺、建築面積110㎡,,40 － 0020,32,2002.03.12(平成14.03.12),2002.02.14(平成14.02.14),,20020214,,国土の歴史的景観に寄与しているもの,,福岡県,福岡県築上郡築上町大字上深野396,,,,,33.63670000000000,130.99460000000000,東西棟の桟瓦葺・入母屋造で，周囲に銅板葺の下屋庇を廻し，内部は１５畳と１０畳の２室からなる。付書院や欄間の細工など，良材を用いた繊細な造形である。年代は主屋と同時期で，主屋と東北隅で繋がり，大玄関棟や茶室と雁行し，連続感のある構成をつくる。,https://bunka.nii.ac.jp/heritage/43967/_103691/43967_103691111225013149505_300.jpg
101,00002702,旧蔵内家住宅主屋,きゅうくらうちけじゅうたくしゅおく,1棟,,登録有形文化財(建造物),住宅,建築物,,明治,明治20,1887,木造2階建、瓦葺、建築面積256㎡,,40 － 0021,32,2002.03.12(平成14.03.12),2002.02.14(平成14.02.14),,20020214,,国土の歴史的景観に寄与しているもの,,福岡県,福岡県築上郡築上町大字上深野396,,,,,33.63668000000000,130.99440000000000,東を正面とした桁行８間半，梁間４間の総２階建，南北棟・桟瓦葺・入母屋造の屋根を上げた建物で，大邸宅の中心に相応しい雄大さを備えている。西面には低い屋根を架けて，１階に居間など内向きの部屋を設けている。竣工写真から建築年代が判明する。,https://bunka.nii.ac.jp/heritage/43967/_103692/43967_103692111225013150028_300.jpg
101,00002703,旧蔵内家住宅茶室,きゅうくらうちけじゅうたくちゃしつ,1棟,,登録有形文化財(建造物),住宅,建築物,,大正,大正8,1919,木造平屋建、銅板葺、建築面積47㎡,,40 － 0022,32,2002.03.12(平成14.03.12),2002.02.14(平成14.02.14),,20020214,,造形の規範となっているもの,,福岡県,福岡県築上郡築上町大字上深野396,,,,,33.63679000000000,130.99450000000000,主屋北側に位置し，応接棟の北西隅と巧みに接続している。入母屋造で，周囲に下屋庇を廻し，その西面には入母屋破風を設ける。現在銅板葺であるが当初は檜皮葺であった。茶室は８畳で，床の間の落掛に竹を用い，全体を木割の細い数寄屋風意匠で纏めている。,https://bunka.nii.ac.jp/heritage/43967/_103693/43967_103693111225013151414_300.jpg
101,00002704,旧蔵内家住宅座敷棟,きゅうくらうちけじゅうたくざしきとう,1棟,,登録有形文化財(建造物),住宅,建築物,,大正,大正6,1917,木造平屋建、瓦葺、建築面積138㎡,,40 － 0023,32,2002.03.12(平成14.03.12),2002.02.14(平成14.02.14),,20020214,,造形の規範となっているもの,,福岡県,福岡県築上郡築上町大字上深野396,,,,,33.63683000000000,130.99430000000000,主屋の北西に接続する建物で，大広間棟などとともに，事業拡大を図った大正期に整えられた。東西棟・入母屋造・桟瓦葺で，周囲に一間幅の下屋庇をつける。内部は１０畳間２室で，主屋側の室に床の間や付書院を設け，数寄屋風の丁寧なつくりになっている。,https://bunka.nii.ac.jp/heritage/43967/_103694/43967_103694111225013151945_300.jpg
101,00002705,旧蔵内家住宅大広間棟,きゅうくらうちけじゅうたくおおひろまとう,1棟,,登録有形文化財(建造物),住宅,建築物,,大正,大正7,1918,木造平屋建、瓦葺、建築面積240㎡,,40 － 0024,32,2002.03.12(平成14.03.12),2002.02.14(平成14.02.14),,20020214,,国土の歴史的景観に寄与しているもの,,福岡県,福岡県築上郡築上町大字上深野396,,,,,33.63696000000000,130.99440000000000,座敷棟の北にある南北棟の長大な建物で，東に築かれた庭園に臨んで建ち，格調ある佇まいをみせる。屋根はＴ字型の大棟で三方に破風を設け，周囲に庇を廻す。１８畳が２室続く内部も広壮で座敷飾にも特色がある。棟札より棟梁は近郷山田村の中江九壽と判る。,https://bunka.nii.ac.jp/heritage/43967/_103695/43967_103695111225013152476_300.jpg
101,00002706,旧蔵内家住宅炊事場棟,きゅうくらうちけじゅうたくすいじばとう,1棟,,登録有形文化財(建造物),住宅,建築物,,大正,大正5,1916,木造平屋建、瓦葺、建築面積178㎡,,40 － 0025,32,2002.03.12(平成14.03.12),2002.02.14(平成14.02.14),,20020214,,造形の規範となっているもの,,福岡県,福岡県築上郡築上町大字上深野396,,,,,33.63670000000000,130.99430000000000,主屋西面の南側で接続する。炊事場・食堂・台所・浴室・便所・井戸など，居住のサービス機能を備えた部分である。真壁造で端整なつくりになるが，東西棟・入母屋造・桟瓦葺の大屋根を架け，入母屋造の一段低い下屋を各方向に付けた賑やかな外観としている。,https://bunka.nii.ac.jp/heritage/43967/_103696/43967_103696111225013153007_300.jpg
101,00002707,旧蔵内家住宅宝蔵,きゅうくらうちけじゅうたくほうぞう,1棟,,登録有形文化財(建造物),住宅,建築物,,明治,明治20頃,1887頃,木造2階建、瓦葺、建築面積116㎡,,40 － 0026,32,2002.03.12(平成14.03.12),2002.02.14(平成14.02.14),,20020214,,再現することが容易でないもの,,福岡県,福岡県築上郡築上町大字上深野396,,,,,33.63683000000000,130.99420000000000,座敷棟と炊事場の後方，屋敷西面中央に建つ収蔵施設。桁行１０間の壮大な規模を有し，南北に細長い切妻造・桟瓦葺・２階建の土蔵で，内部の南北に２箇所の階段を設ける。壁面は丁寧な仕上の漆喰塗とし，小庇付窓を数多く配するなど，特色あるつくりである。,https://bunka.nii.ac.jp/heritage/43967/_103697/43967_103697111225013153275_300.jpg
101,00002708,旧蔵内家住宅米倉,きゅうくらうちけじゅうたくこめぐら,1棟,,登録有形文化財(建造物),住宅,建築物,,昭和前,昭和初期,1926-1988,木造2階建、瓦葺、建築面積88㎡,,40 － 0027,32,2002.03.12(平成14.03.12),2002.02.14(平成14.02.14),,20020214,,国土の歴史的景観に寄与しているもの,,福岡県,福岡県築上郡築上町大字上深野396,,,,,33.63654000000000,130.99430000000000,主屋の南側にある米を収蔵していた土蔵で，主屋側に庇を設け，渡廊下で連絡していた。東西に細長い建物で，桟瓦葺の屋根は東妻を兜造風，西妻を切妻造とする。道路に面した南壁面は漆喰塗で腰を縦板張とするが，東妻は下見板張とし，存在感のある外観である。,https://bunka.nii.ac.jp/heritage/43967/_103698/43967_103698111225013153805_300.jpg
101,00002709,旧蔵内家住宅倉,きゅうくらうちけじゅうたくくら,1棟,,登録有形文化財(建造物),住宅,建築物,,昭和前,昭和前期,1926-1988,木造平屋建、瓦葺、建築面積173㎡,,40 － 0028,32,2002.03.12(平成14.03.12),2002.02.14(平成14.02.14),,20020214,,国土の歴史的景観に寄与しているもの,,福岡県,福岡県築上郡築上町大字上深野396,,,,,33.63660000000000,130.99410000000000,屋敷南西の角地を画するように建ち，東面で米倉と接する。Ｌ字型平面とし，南面のほぼ中央に通用門を構え，内部を分けて農機具倉・左官倉・大工倉などに用いていた。屋根は桟瓦葺，真壁造で外廻りの腰を縦板張にする。大邸宅の屋敷構成を特色づける施設。,https://bunka.nii.ac.jp/heritage/43967/_103699/43967_103699111225013155064_300.jpg
