101,00009544,多田家住宅隠居屋,ただけじゅうたくいんきょや,1棟,,登録有形文化財(建造物),住宅,建築物,,昭和前,昭和8年頃,1933頃,木造2階建、瓦葺、建築面積94㎡,,40 － 0087,74,2013.03.29(平成25.03.29),2013.03.29(平成25.03.29),,20130329,,国土の歴史的景観に寄与しているもの,,福岡県,福岡県朝倉郡筑前町森山字耳取417-1,,,,,33.45260000000000,130.62270000000000,主屋北東に雁行して建ち、木造二階建、建築面積九四平方メートル、入母屋造桟瓦葺である。下階は仏間を備えた座敷とし、仏壇脇に花頭窓を穿つ。上階は座敷と書斎からなり、数寄屋風を加味した意匠とする。上下階とも周囲に縁と庇を廻らし、ガラス窓を建てる。,https://bunka.nii.ac.jp/heritage/43967/_194337/43967_194337140916101106945_300.jpg
101,00009545,多田家住宅前ノ蔵,ただけじゅうたくまえのくら,1棟,,登録有形文化財(建造物),住宅,建築物,,明治,明治3年,1870,土蔵造平屋一部2階建、瓦葺、建築面積40㎡,,40 － 0088,74,2013.03.29(平成25.03.29),2013.03.29(平成25.03.29),,20130329,,国土の歴史的景観に寄与しているもの,,福岡県,福岡県朝倉郡筑前町森山字耳取417-1,,,,,33.45247000000000,130.62230000000000,主屋西面に東西棟で建つ。土蔵造平屋一部二階建、桁行七・九メートル梁間五・一メートル、切妻造桟瓦葺で東面に戸口を設ける。外壁は漆喰塗で腰を海鼠壁とし、木瓜形に縁取りした小窓に銅扉を吊り、漆喰塗の小庇を付ける。主屋とともに重厚な表構えをつくる。,https://bunka.nii.ac.jp/heritage/43967/_194338/43967_194338140916101107980_300.jpg
101,00009546,多田家住宅長蔵,ただけじゅうたくながくら,1棟,,登録有形文化財(建造物),住宅,建築物,,江戸,江戸末期／明治24年改修,1830～1868／1891改修,土蔵造平屋建、瓦葺、建築面積159㎡,,40 － 0089,74,2013.03.29(平成25.03.29),2013.03.29(平成25.03.29),,20130329,,国土の歴史的景観に寄与しているもの,,福岡県,福岡県朝倉郡筑前町森山字耳取417-1,,,,,33.45274000000000,130.62240000000000,主屋北辺西寄りに東西棟で建つ長大な蔵。土蔵造平屋建、桁行二三・二メートル梁間六・九メートル、切妻造桟瓦葺で、南面二箇所に戸口を設ける。外壁は漆喰塗で腰を海鼠壁とし、南面上部に小窓を穿つ。敷地内で最古の建物として、往時の屋敷構えを伝える。,https://bunka.nii.ac.jp/heritage/43967/_194339/43967_194339140916101109079_300.jpg
101,00009547,多田家住宅納屋,ただけじゅうたくなや,1棟,,登録有形文化財(建造物),住宅,建築物,,昭和前,昭和8年頃,1933頃,木造平屋建、瓦葺、建築面積19㎡,,40 － 0090,74,2013.03.29(平成25.03.29),2013.03.29(平成25.03.29),,20130329,,国土の歴史的景観に寄与しているもの,,福岡県,福岡県朝倉郡筑前町森山字耳取417-1,,,,,33.45253000000000,130.62220000000000,主屋北西に広がる裏庭に北面して建つ。木造平屋建、桁行一〇・一メートル梁間一・九メートル、片流招屋根付、桟瓦葺である。南面は、東西にのびる土塀と一連の意匠とし、北面は一部を板壁とする。内部を東西四室に間仕切り、東端を便所とする。,https://bunka.nii.ac.jp/heritage/43967/_194340/43967_194340140916101110129_300.jpg
101,00009548,多田家住宅倉庫,ただけじゅうたくそうこ,1棟,,登録有形文化財(建造物),住宅,建築物,,昭和前,昭和8年頃,1933頃,木造2階建、瓦葺、建築面積26㎡,,40 － 0091,74,2013.03.29(平成25.03.29),2013.03.29(平成25.03.29),,20130329,,国土の歴史的景観に寄与しているもの,,福岡県,福岡県朝倉郡筑前町森山字耳取417-1,,,,,33.45257000000000,130.62210000000000,納屋西側、材木蔵の南側に南北棟で建つ。木造二階建、桁行五・三メートル梁間五・〇メートル、切妻造桟瓦葺で、東面を下屋とする。昭和二〇年頃まで使用人住居として使用されたため、二階窓に格子を建てる。旧家の暮らしぶりを伝える倉庫である。,https://bunka.nii.ac.jp/heritage/43967/_194341/43967_194341140916101111237_300.jpg
101,00009549,多田家住宅材木蔵,ただけじゅうたくざいもくぐら,1棟,,登録有形文化財(建造物),住宅,建築物,,昭和前,昭和8年頃,1933頃,土蔵造一部木造平屋建、瓦葺、建築面積102㎡,,40 － 0092,74,2013.03.29(平成25.03.29),2013.03.29(平成25.03.29),,20130329,,国土の歴史的景観に寄与しているもの,,福岡県,福岡県朝倉郡筑前町森山字耳取417-1,,,,,33.45265000000000,130.62210000000000,敷地西辺北端に南北棟で建ち、南半を土蔵造平屋建の材木置場、北半を木造平屋建の薪置場とする。屋根は段違いの切妻造桟瓦葺とし、東面に下屋を設ける。外壁は材木置場を漆喰塗及び海鼠壁とし、薪置場は中塗仕上げとする。背面側の屋敷景観を整える大型の蔵。,https://bunka.nii.ac.jp/heritage/43967/_194342/43967_194342140916101112315_300.jpg
101,00009550,多田家住宅北ノ蔵,ただけじゅうたくきたのくら,1棟,,登録有形文化財(建造物),住宅,建築物,,昭和前,昭和8年頃,1933頃,土蔵造平屋建、瓦葺、建築面積22㎡,,40 － 0093,74,2013.03.29(平成25.03.29),2013.03.29(平成25.03.29),,20130329,,国土の歴史的景観に寄与しているもの,,福岡県,福岡県朝倉郡筑前町森山字耳取417-1,,,,,33.45276000000000,130.62260000000000,隠居屋後方に南北棟で建つ。土蔵造平屋建、桁行五・六メートル梁間四・〇メートル、切妻造桟瓦葺で西面に戸口を設ける。布石積基礎上に建ち、外壁は漆喰塗で隅部のみ腰に瓦を貼る。東面に高窓を穿ち、銅扉を開く。弓道場とともに、良質な屋敷景観をつくる。,https://bunka.nii.ac.jp/heritage/43967/_194343/43967_194343140916101113321_300.jpg
101,00009551,多田家住宅器蔵,ただけじゅうたくうつわぐら,1棟,,登録有形文化財(建造物),住宅,建築物,,昭和前,昭和8年頃,1933頃,土蔵造2階建、瓦葺、建築面積37㎡、渡廊下付,,40 － 0094,74,2013.03.29(平成25.03.29),2013.03.29(平成25.03.29),,20130329,,国土の歴史的景観に寄与しているもの,,福岡県,福岡県朝倉郡筑前町森山字耳取417-1,,,,,33.45263000000000,130.62280000000000,隠居屋東面に、太鼓橋状の渡廊下を介して東西棟で建つ。土蔵造二階建、桁行七・六メートル梁間四・八メートル、切妻造桟瓦葺である。外壁は漆喰塗で腰を海鼠壁とし、南面に上下二箇所ずつ窓を穿つ。什器類を収めた土蔵で、主庭の景観を引き立てている。,https://bunka.nii.ac.jp/heritage/43967/_194344/43967_194344140916101114409_300.jpg
101,00009552,多田家住宅弓道場,ただけじゅうたくきゅうどうじょう,1棟,,登録有形文化財(建造物),住宅,建築物,,昭和前,昭和8年頃,1933頃,木造平屋建、瓦葺、建築面積22㎡,,40 － 0095,74,2013.03.29(平成25.03.29),2013.03.29(平成25.03.29),,20130329,,国土の歴史的景観に寄与しているもの,,福岡県,福岡県朝倉郡筑前町森山字耳取417-1,,,,,33.45274000000000,130.62270000000000,北ノ蔵東隣に東面して建つ。木造平屋建、桁行五・〇メートル梁間四・三メートル、切妻造桟瓦葺で、三面に庇を廻らせ、南東面にガラス窓を建てる。内部は北半を板敷の射場とし、南側に四畳の控えを配し神棚を祀る。屋敷地内に残る軽快なつくりの弓道場である。,https://bunka.nii.ac.jp/heritage/43967/_194345/43967_194345140916101116035_300.jpg
101,00009553,多田家住宅的場,ただけじゅうたくまとば,1棟,,登録有形文化財(建造物),住宅,建築物,,昭和前,昭和8年頃,1933頃,木造平屋建、瓦葺、建築面積7.9㎡,,40 － 0096,74,2013.03.29(平成25.03.29),2013.03.29(平成25.03.29),,20130329,,国土の歴史的景観に寄与しているもの,,福岡県,福岡県朝倉郡筑前町森山字耳取417-1,,,,,33.45276000000000,130.62300000000000,弓道場と相対し、西面して建つ。木造平屋建、桁行四メートル梁間二メートル、切妻造桟瓦葺。正面内法高に虹梁を架けて吹放しとし、残る三面は土壁とし、腰に杉皮を張る。虹梁上と隅柱には舟肘木を載せて桁を受ける。弓道場とともに屋敷景観に趣を添える。,https://bunka.nii.ac.jp/heritage/43967/_194346/43967_194346140916101117060_300.jpg
101,00009554,多田家住宅物置,ただけじゅうたくものおき,1棟,,登録有形文化財(建造物),住宅,建築物,,昭和前,昭和8年頃,1933頃,木造平屋建、瓦葺、建築面積6.6㎡,,40 － 0097,74,2013.03.29(平成25.03.29),2013.03.29(平成25.03.29),,20130329,,国土の歴史的景観に寄与しているもの,,福岡県,福岡県朝倉郡筑前町森山字耳取417-1,,,,,33.45268000000000,130.62300000000000,的場の南側に、勝手門を挟んで建つ。木造平屋建、桁行三・四メートル梁間一・九メートル、切妻造桟瓦葺で、当地方で用いられた左桟瓦を葺く。平面は西正面を吹放しとし、他の三面を土壁とする。裏山で収集した薪や柴などを収めた、簡素なつくりの物置である。,https://bunka.nii.ac.jp/heritage/43967/_194347/43967_194347140916101118102_300.jpg
101,00009555,多田家住宅表門,ただけじゅうたくおもてもん,1棟,,登録有形文化財(建造物),住宅,その他工作,,明治,明治24年頃,1891頃,木造、瓦葺、間口2.9m、潜戸付,,40 － 0098,74,2013.03.29(平成25.03.29),2013.03.29(平成25.03.29),,20130329,,国土の歴史的景観に寄与しているもの,,福岡県,福岡県朝倉郡筑前町森山字耳取417-1,,,,,33.45243000000000,130.62230000000000,敷地南面に通りからやや後退して建つ。桁行二・九メートル梁間一・七メートルの薬医門形式で、切妻造桟瓦葺とし、西側に潜戸を開く。親柱は正面側半分を花崗岩の石柱、背面側を木柱として冠木を受ける独特なつくりの表門で、風格のある表構えを形成する。,https://bunka.nii.ac.jp/heritage/43967/_194348/43967_194348140916101119731_300.jpg
101,00009556,多田家住宅裏門,ただけじゅうたくうらもん,1棟,,登録有形文化財(建造物),住宅,その他工作,,明治,明治5年頃,1872頃,木造、瓦葺、間口2.1m,,40 － 0099,74,2013.03.29(平成25.03.29),2013.03.29(平成25.03.29),,20130329,,国土の歴史的景観に寄与しているもの,,福岡県,福岡県朝倉郡筑前町森山字耳取417-1,,,,,33.45259000000000,130.62300000000000,敷地東辺中央に建ち、潜戸付きの板戸を両開きに吊る。間口二・一メートルの薬医門形式で、切妻造桟瓦葺とする。屋敷地前面を通る日田街道が、明治初年までは当門の位置を通過していたとする由緒に因む門で、屋敷地の変遷を伝える記念的意味を持つ裏門。,https://bunka.nii.ac.jp/heritage/43967/_194349/43967_194349140916101120869_300.jpg
101,00009557,多田家住宅勝手門,ただけじゅうたくかってもん,1棟,,登録有形文化財(建造物),住宅,その他工作,,昭和前,昭和8年頃,1933頃,木造、瓦葺、間口2.0m,,40 － 0100,74,2013.03.29(平成25.03.29),2013.03.29(平成25.03.29),,20130329,,国土の歴史的景観に寄与しているもの,,福岡県,福岡県朝倉郡筑前町森山字耳取417-1,,,,,33.45272000000000,130.62300000000000,敷地東辺の北寄り、的場と物置の間に建つ。間口二・〇メートルの腕木門形式で、柱間に板戸を両開きに吊る。屋根は切妻造桟瓦葺とし、東面屋根には左桟瓦を葺く。南北面に付属する土塀も左桟瓦を葺いており、地方的特色のある屋敷景観を形成している。,https://bunka.nii.ac.jp/heritage/43967/_194350/43967_194350140916101121940_300.jpg
101,00009558,多田家住宅石塀,ただけじゅうたくいしべい,1基,,登録有形文化財(建造物),住宅,その他工作,,昭和前,昭和8年頃,1933頃,石造、総延長48m,,40 － 0101,74,2013.03.29(平成25.03.29),2013.03.29(平成25.03.29),,20130329,,国土の歴史的景観に寄与しているもの,,福岡県,福岡県朝倉郡筑前町森山字耳取417-1,,,,,33.45238000000000,130.62220000000000,敷地南辺の西寄り、表門から東西に折れ曲がりにのびる。自然石の石垣上に布石を伏せ、江戸切り仕上げの積石を積み上げる。積石は、表門両側では五段積み、通り沿いでは三段積とし、総延長四七・八メートルを測る。旧家らしい風格ある屋敷構えをみせる。,https://bunka.nii.ac.jp/heritage/43967/_194351/43967_194351140916101123025_300.jpg
101,00009559,多田家住宅土塀,ただけじゅうたくどべい,1棟,,登録有形文化財(建造物),住宅,その他工作,,昭和前,昭和8年頃／昭和中期改修,1933頃／1946～1965改修,木造、瓦葺、総延長106m,,40 － 0102,74,2013.03.29(平成25.03.29),2013.03.29(平成25.03.29),,20130329,,国土の歴史的景観に寄与しているもの,,福岡県,福岡県朝倉郡筑前町森山字耳取417-1,,,,,33.45277000000000,130.62280000000000,主屋南東側の一郭や、敷地北東側の附属屋の間に折曲がりにのびる土塀で、総延長一〇六メートルを測る。木造、切妻造桟瓦葺で、屋根に左桟瓦を葺く。布石基礎上に建ち、壁は漆喰塗で腰を杉皮張や簓子下見板張とする。落ち着いた風情のある屋敷景観を形成する。,https://bunka.nii.ac.jp/heritage/43967/_194352/43967_194352140916101124105_300.jpg
101,00009847,向野堅一記念館（旧讃井病院）,こうのけんいちきねんかん（きゅうさぬいびょういん）,1棟,,登録有形文化財(建造物),生活関連,建築物,,大正,大正11,1922,木造2階建、瓦葺、建築面積227㎡、塔屋付,,40 － 0103,76,2013.12.24(平成25.12.24),2013.12.24(平成25.12.24),,20131224,,国土の歴史的景観に寄与しているもの,,福岡県,福岡県直方市大字直方594-3他,,,,,33.74403000000000,130.72800000000000,角地に建つＬ字形平面の木造二階建で、隅部を塔屋とする。正面に玄関ポーチを構え、左右張出し部に大オーダーを表し、頂部に台形のパラペットを飾る。内部は一階がもと診療室や薬局などで、二階に和室を配する。ゼツェッション意匠を基調とする、もと医院。,https://bunka.nii.ac.jp/heritage/43967/_195676/43967_195676140222030023045_300.jpg
101,00009848,直方谷尾美術館洋館（旧奥野医院）,のおがたたにおびじゅつかんようかん（きゅうおくのいいん）,1棟,,登録有形文化財(建造物),生活関連,建築物,,昭和前,昭和16頃／平成期改修,1941頃／1989～改修,木造2階建、鉄板葺、建築面積265㎡,,40 － 0104,76,2013.12.24(平成25.12.24),2013.12.24(平成25.12.24),,20131224,,国土の歴史的景観に寄与しているもの,,福岡県,福岡県直方市殿町534-1他,,直方市,市区町村,,33.74331000000000,130.72820000000000,正面中央の玄関ポーチにコンポジット式円柱を立ててコーニスを受け、玄関ホールにはコリント式円柱を配する。周囲の外壁はタイル貼で柱形を表し、縦長窓を連続させ、また側面に半円形平面の応接間を張出すなど、古典様式とモダニズムを融合した外観をもつ。,https://bunka.nii.ac.jp/heritage/43967/_195677/43967_195677140905092520802_300.jpg
101,00009849,直方谷尾美術館和館（旧奥野家住宅主屋）,のおがたたにおびじゅつかんわかん（きゅうおくのけじゅうたくしゅおく）,1棟,,登録有形文化財(建造物),生活関連,建築物,,昭和前,昭和16頃／平成期改修,1941頃／1989～改修,木造及び土蔵造2階建、瓦葺、建築面積259㎡,,40 － 0105,76,2013.12.24(平成25.12.24),2013.12.24(平成25.12.24),,20131224,,国土の歴史的景観に寄与しているもの,,福岡県,福岡県直方市殿町534-1他,,直方市,市区町村,,33.74324000000000,130.72850000000000,洋館後方に建つ和風住宅で、洋館接続部に玄関を構える。北東寄りの二階建部分には、もとの客間などがあり、南西隅に二階建土蔵の収蔵庫を附属する。落着いた佇まいの住宅で、洋風意匠の医院部分と好対照をなし、大正期の直方における医院建築の様相を伝える。,https://bunka.nii.ac.jp/heritage/43967/_195678/43967_195678140905092522722_300.jpg
101,00009850,直方谷尾美術館茶室鉄牛庵,のおがたたにおびじゅつかんちゃしつてつぎゅうあん,1棟,,登録有形文化財(建造物),生活関連,建築物,,昭和前,昭和16頃,1941頃,木造平屋建、瓦葺、建築面積42㎡,,40 － 0106,76,2013.12.24(平成25.12.24),2013.12.24(平成25.12.24),,20131224,,国土の歴史的景観に寄与しているもの,,福岡県,福岡県直方市殿町534-1他,,直方市,市区町村,,33.74328000000000,130.72860000000000,細長い敷地の東奥部に建つ。和館と渡廊下を介して繋ぎ、南側に庭園を控える。切妻造桟瓦葺で内外観とも数寄屋意匠とし、外壁は中塗仕上げとする。平面は東端に四畳半茶室をおき、手前に水屋、六畳の待合を直列させる。茶の湯を嗜んだ施主の好みを伝える。,https://bunka.nii.ac.jp/heritage/43967/_195679/43967_195679140916101836729_300.jpg
101,00009851,前田園本店店舗,まえだえんほんてんてんぽ,1棟,,登録有形文化財(建造物),産業3次,建築物,,昭和前,昭和2頃,1927頃,木造2階建、瓦葺、建築面積112㎡,,40 － 0107,76,2013.12.24(平成25.12.24),2013.12.24(平成25.12.24),,20131224,,国土の歴史的景観に寄与しているもの,,福岡県,福岡県直方市殿町590-1,,,,,33.74381000000000,130.72790000000000,通りに東面し、木造二階建、切妻造桟瓦葺である。正面二階は出桁造で壁を黒漆喰で仕上げ、腰部と大振りの窓枠を銅板張とし、瓦葺の庇を付ける。一階内部はケヤキの良材を用いた普請でミセなどを配し、二階は座敷とする。近代直方の商家の様相を伝える店舗。,https://bunka.nii.ac.jp/heritage/43967/_195680/43967_195680140905092524650_300.jpg
101,00009852,前田園本店倉庫,まえだえんほんてんそうこ,1棟,,登録有形文化財(建造物),産業3次,建築物,,昭和前,昭和2頃,1927頃,煉瓦造及び木造2階建、瓦葺、建築面積111㎡,,40 － 0108,76,2013.12.24(平成25.12.24),2013.12.24(平成25.12.24),,20131224,,国土の歴史的景観に寄与しているもの,,福岡県,福岡県直方市殿町590-1,,,,,33.74376000000000,130.72770000000000,店舗の後方に座敷などを介して東西棟で建ち、煉瓦造及び木造二階建、切妻造桟瓦葺である。東妻が出入口で西妻に鉄板張の扉を開き、周囲に窓を穿つ。外壁は鉄板張で内部をモルタル仕上とし、小屋はキングポストトラスを組む。茶などの保管用に建てられた倉庫。,https://bunka.nii.ac.jp/heritage/43967/_195681/43967_195681140905092526574_300.jpg
101,00009853,石原商店店舗,いしはらしょうてんてんぽ,1棟,,登録有形文化財(建造物),産業3次,建築物,,大正,大正15,1926,木造2階建、瓦葺、建築面積70㎡,,40 － 0109,76,2013.12.24(平成25.12.24),2013.12.24(平成25.12.24),,20131224,,国土の歴史的景観に寄与しているもの,,福岡県,福岡県直方市殿町590-3,,,,,33.74394000000000,130.72790000000000,前田園本店の北隣に並び建ち、木造二階建、切妻造桟瓦葺。二階正面に穿つ横長の大窓下に中二階用の小窓を並べて庇を付け、一階の軒庇とともに、三層構成の立面とする。内部のミセ上部を一部吹抜とし二階は座敷とする。前田園とともに良質な街路景観をつくる。,https://bunka.nii.ac.jp/heritage/43967/_195682/43967_195682140905092527550_300.jpg
101,00009854,アートスペース谷尾（旧十七銀行直方支店）,あーとすぺーすたにお（きゅうじゅうしちぎんこうのおがたしてん）,1棟,,登録有形文化財(建造物),産業3次,建築物,,大正,大正2頃,1913頃,木造及び煉瓦造2階建、鉄板葺、建築面積375㎡,,40 － 0110,76,2013.12.24(平成25.12.24),2013.12.24(平成25.12.24),,20131224,,国土の歴史的景観に寄与しているもの,,福岡県,福岡県直方市古町929-1他,,直方市,市区町村,,33.74602000000000,130.72780000000000,角地に建つ木造二階建、鉄板葺で、南東隅を塔屋風に張出す。外壁は煉瓦風タイル小口貼で、基礎やバンド、窓台などに花崗岩を用いてアクセントとし、玄関廻りや柱形などの細部はゼツェッションでまとめる。地域のランドマークとして親しまれる、もと銀行建築。,https://bunka.nii.ac.jp/heritage/43967/_195683/43967_195683140718091813426_300.jpg
101,00010236,門司ゴルフ倶楽部クラブハウス南棟,もじごるふくらぶくらぶはうすみなみとう,1棟,,登録有形文化財(建造物),産業3次,建築物,,昭和中,昭和35,1960,鉄筋コンクリート造2階建、鉄板葺、建築面積1257㎡,,40 － 0111,78,2014.10.07(平成26.10.07),2014.10.07(平成26.10.07),,20141007,,造形の規範となっているもの,,福岡県,福岡県北九州市門司区大字吉志字稗畑175-10,,社団法人門司ゴルフ倶楽部,非営利法人,,33.86740000000000,130.96420000000000,桁行五五メートル梁間二二メートルを測る鉄筋コンクリート造二階建のクラブハウス。開放的で水平線を強調した立面とし、内部は打放しコンクリートの躯体で大空間を確保し、丸太の小屋を組む。いわゆるレーモンドスタイルが遺憾なく発揮されたモダニズム建築。,https://bunka.nii.ac.jp/heritage/43967/_198069/43967_198069150317212811149_300.jpg
101,00010237,門司ゴルフ倶楽部クラブハウス北棟,もじごるふくらぶくらぶはうすきたとう,1棟,,登録有形文化財(建造物),産業3次,建築物,,昭和中,昭和35,1960,鉄筋コンクリート造平屋建一部地下1階建、鉄板葺、建築面積434㎡,,40 － 0112,78,2014.10.07(平成26.10.07),2014.10.07(平成26.10.07),,20141007,,造形の規範となっているもの,,福岡県,福岡県北九州市門司区大字吉志字稗畑175-10,,社団法人門司ゴルフ倶楽部,非営利法人,,33.86740000000000,130.96420000000000,南棟と接続して建ち、東西四〇メートル南北九・一メートルを測る平屋建。キャディー室などのサービス機能を集約して設備充実を図りつつ、プレイヤー用の浴室なども配置するが、プレイヤーとキャディーの動線が交錯しないよう合理的に計画された平面をもつ。,https://bunka.nii.ac.jp/heritage/43967/_198070/43967_198070150317212812556_300.jpg
101,00010238,門司ゴルフ倶楽部スタートハウス,もじごるふくらぶすたーとはうす,1棟,,登録有形文化財(建造物),産業3次,建築物,,昭和中,昭和35,1960,木造平屋建、鉄板葺、建築面積33㎡,,40 － 0113,78,2014.10.07(平成26.10.07),2014.10.07(平成26.10.07),,20141007,,造形の規範となっているもの,,福岡県,福岡県北九州市門司区大字吉志字稗畑175-10,,社団法人門司ゴルフ倶楽部,非営利法人,,33.86740000000000,130.96420000000000,木造平屋建で、桁行九・四メートル、梁間三・八メートルを測る。屋根や外壁はクラブハウスと同系色のオレンジ色に近い赤色塗装を施し、丸太の桁を現す。平面は三室とし、左右を待合、中央を管理室とする。腰高の水平連続窓を設け、開放感のある構成になる。,https://bunka.nii.ac.jp/heritage/43967/_198071/43967_198071150317212814034_300.jpg
101,00010375,九州鉄道記念館（旧九州鉄道本社）,きゅうしゅうてつどうきねんかん（きゅうきゅうしゅうてつどうほんしゃ）,1棟,,登録有形文化財(建造物),交通,建築物,,明治,明治24年／平成15年改修,1891年／2003年改修,煉瓦造2階建、金属板葺、建築面積805㎡,,40-0114,79,2014.12.19(平成26.12.19),2014.12.19(平成26.12.19),,20141219,,再現することが容易でないもの,,福岡県,福岡県北九州市門司区清滝2-909-3他,,九州旅客鉄道株式会社,営利法人,,33.94314000000000,130.96170000000000,東西長さ六三メートルに及ぶ煉瓦造建築で、南北面中央に切妻造の玄関部を張出す。外壁はフランス積で欠円アーチ窓を連続させ、妻面にペディメントを飾り、中段に廻るコーニスでは焼過煉瓦を矢筈に積み、意匠を凝らす。九州鉄道の黎明期を伝える大規模建築。,https://bunka.nii.ac.jp/heritage/43967/_199147/43967_199147150807110650775_300.jpg
